tweet_id,tweet_link,in_reply_to_status_id,in_reply_to_user_id,timestamp,source,text,retweeted_status_id,retweeted_status_user_id,retweeted_status_timestamp,expanded_urls
616441802023960576,https://twitter.com/POTUS44/status/616441802023960576,,,2015-07-02 03:02:33 +0000,"<a href=""http://twitter.com/download/iphone"" rel=""nofollow"">Twitter for iPhone</a>",It's not mine; just a loaner. Maybe you can come play at the White House sometime instead?  https://t.co/srZKB6plzz,,,,https://twitter.com/theblackkeys/status/616364682895564800
617430014422843392,https://twitter.com/POTUS44/status/617430014422843392,,,2015-07-04 20:29:21 +0000,"<a href=""http://twitter.com/download/iphone"" rel=""nofollow"">Twitter for iPhone</a>","It doesn't get much better than celebrating America with the people you love. Happy Fourth of July, everyone!",,,,
617542692952764417,https://twitter.com/POTUS44/status/617542692952764417,617430014422843392,1536791610,2015-07-05 03:57:06 +0000,"<a href=""http://twitter.com/download/iphone"" rel=""nofollow"">Twitter for iPhone</a>",http://t.co/Ft3DwYWRJv,,,,https://twitter.com/POTUS/status/617542692952764417/photo/1
617860799953010688,https://twitter.com/POTUS44/status/617860799953010688,,,2015-07-06 01:01:08 +0000,"<a href=""http://twitter.com/download/iphone"" rel=""nofollow"">Twitter for iPhone</a>",What a win for Team USA! Great game @CarliLloyd! Your country is so proud of all of you. Come visit the White House with the World Cup soon.,,,,
619509587272691712,https://twitter.com/POTUS44/status/619509587272691712,,,2015-07-10 14:12:50 +0000,"<a href=""http://twitter.com/#!/download/ipad"" rel=""nofollow"">Twitter for iPad</a>","South Carolina taking down the confederate flag - a signal of good will and healing, and a meaningful step towards a better future.",,,,
621081548029345792,https://twitter.com/POTUS44/status/621081548029345792,,,2015-07-14 22:19:14 +0000,"<a href=""http://twitter.com/download/iphone"" rel=""nofollow"">Twitter for iPhone</a>","Just spoke to the NAACP about criminal justice reform, something many broadly agree on. Some stats:",,,,
621081946236563456,https://twitter.com/POTUS44/status/621081946236563456,621081548029345792,1536791610,2015-07-14 22:20:49 +0000,"<a href=""http://twitter.com/download/iphone"" rel=""nofollow"">Twitter for iPhone</a>","America is home to 5% of the world's population, but 25% of the world's prisoners.",,,,
621083313063763968,https://twitter.com/POTUS44/status/621083313063763968,621081946236563456,1536791610,2015-07-14 22:26:15 +0000,"<a href=""http://twitter.com/download/iphone"" rel=""nofollow"">Twitter for iPhone</a>",America keeps more people behind bars than the top 35 European countries combined.,,,,
621084469970214914,https://twitter.com/POTUS44/status/621084469970214914,621083313063763968,1536791610,2015-07-14 22:30:51 +0000,"<a href=""http://twitter.com/download/iphone"" rel=""nofollow"">Twitter for iPhone</a>","In 1980, there were 500,000 people in American jails. Today, there are 2.2 million. Many belong. But too many are nonviolent offenders.",,,,
621085397007888384,https://twitter.com/POTUS44/status/621085397007888384,621084469970214914,1536791610,2015-07-14 22:34:32 +0000,"<a href=""http://twitter.com/download/iphone"" rel=""nofollow"">Twitter for iPhone</a>",The $80 billion we spend each year to keep people incarcerated could pay for universal pre-K for every 3-year-old and 4-year-old in America.,,,,
621086198254145536,https://twitter.com/POTUS44/status/621086198254145536,621085397007888384,1536791610,2015-07-14 22:37:43 +0000,"<a href=""http://twitter.com/download/iphone"" rel=""nofollow"">Twitter for iPhone</a>",The $80 billion we spend each year on incarcerations could double the salary of every high school teacher in America.,,,,
621087343253057541,https://twitter.com/POTUS44/status/621087343253057541,621086198254145536,1536791610,2015-07-14 22:42:16 +0000,"<a href=""http://twitter.com/download/iphone"" rel=""nofollow"">Twitter for iPhone</a>",We could eliminate tuition at every public college and university in America with the $80 billion we spend each year on incarcerations.,,,,
621088588583800832,https://twitter.com/POTUS44/status/621088588583800832,621087343253057541,1536791610,2015-07-14 22:47:13 +0000,"<a href=""http://twitter.com/download/iphone"" rel=""nofollow"">Twitter for iPhone</a>",Mass incarceration doesn't work. Let's build communities that give kids a shot at success and prisons that prepare people for a 2nd chance.,,,,
621121462649397249,https://twitter.com/POTUS44/status/621121462649397249,,,2015-07-15 00:57:51 +0000,"<a href=""http://twitter.com/download/iphone"" rel=""nofollow"">Twitter for iPhone</a>",Good conversation with Tom Friedman on the deal we reached with Iran. It's a major step toward a safer world.  https://t.co/xwSrH9IoFG,,,,https://twitter.com/tomfriedman/status/621084602644471810
621133763385425920,https://twitter.com/POTUS44/status/621133763385425920,,,2015-07-15 01:46:43 +0000,"<a href=""http://twitter.com/download/iphone"" rel=""nofollow"">Twitter for iPhone</a>",Pluto just had its first visitor! Thanks @NASA - it's a great day for discovery and American leadership. http://t.co/FfztBSMbK0,,,,http://twitter.com/POTUS/status/621133763385425920/photo/1
622091025541136384,https://twitter.com/POTUS44/status/622091025541136384,,,2015-07-17 17:10:33 +0000,"<a href=""http://twitter.com/download/iphone"" rel=""nofollow"">Twitter for iPhone</a>",Congrats to Oregon on passing two years of free community college! Every hardworking student deserves access to higher education.,,,,
622147491862028289,https://twitter.com/POTUS44/status/622147491862028289,,,2015-07-17 20:54:55 +0000,"<a href=""http://twitter.com/download/iphone"" rel=""nofollow"">Twitter for iPhone</a>",Had a great visit today with Emma Didlake - our oldest living veteran at 110-years-young! She's a true American hero. http://t.co/EeeIC3AK4A,,,,https://twitter.com/POTUS/status/622147491862028289/photo/1
623502798366351360,https://twitter.com/POTUS44/status/623502798366351360,,,2015-07-21 14:40:25 +0000,"<a href=""http://twitter.com/download/iphone"" rel=""nofollow"">Twitter for iPhone</a>",RT @TheIranDeal: The historic #IranDeal succeeds in verifying that Iran cannot obtain a nuclear weapon. Follow to get the facts: http://t.c…,623500231666221056,3281853858,2015-07-21 14:30:13 +0000,http://go.wh.gov/IranDealFacts
623661992952377344,https://twitter.com/POTUS44/status/623661992952377344,,,2015-07-22 01:13:00 +0000,"<a href=""http://twitter.com/download/iphone"" rel=""nofollow"">Twitter for iPhone</a>","E.L. Doctorow was one of America's greatest novelists. His books taught me much, and he will be missed.",,,,
624691954224365568,https://twitter.com/POTUS44/status/624691954224365568,,,2015-07-24 21:25:42 +0000,"<a href=""http://twitter.com/download/iphone"" rel=""nofollow"">Twitter for iPhone</a>","Proud to be the first American President to visit Kenya. Happy to see family, and to talk with young Kenyans about the future.",,,,
625411767414444032,https://twitter.com/POTUS44/status/625411767414444032,,,2015-07-26 21:05:59 +0000,"<a href=""http://twitter.com/download/iphone"" rel=""nofollow"">Twitter for iPhone</a>","25 years of the ADA and Americans with disabilities are breaking more barriers than ever, making all of us more free. Let's keep going.",,,,
626794365869010945,https://twitter.com/POTUS44/status/626794365869010945,,,2015-07-30 16:39:56 +0000,"<a href=""http://twitter.com/download/iphone"" rel=""nofollow"">Twitter for iPhone</a>","Happy 50th birthday, Medicare and Medicaid! Two programs, one promise: that every American deserves a basic measure of dignity and security.",,,,
627211041466941441,https://twitter.com/POTUS44/status/627211041466941441,,,2015-07-31 20:15:39 +0000,"<a href=""http://twitter.com/download/iphone"" rel=""nofollow"">Twitter for iPhone</a>","Launching a pilot program to help students in prison pay for college, because everyone willing to work for it deserves a second chance.",,,,
627560699347255297,https://twitter.com/POTUS44/status/627560699347255297,,,2015-08-01 19:25:04 +0000,"<a href=""http://twitter.com/download/iphone"" rel=""nofollow"">Twitter for iPhone</a>","Hey @StationCDRKelly, loving the photos. Do you ever look out the window and just freak out?",,,,
628280710017720321,https://twitter.com/POTUS44/status/628280710017720321,,,2015-08-03 19:06:08 +0000,"<a href=""http://twitter.com/download/iphone"" rel=""nofollow"">Twitter for iPhone</a>","Today, we're announcing America's Clean Power Plan—the most important step we've ever taken to combat climate change. Here are the facts:",,,,
628280902817304578,https://twitter.com/POTUS44/status/628280902817304578,628280710017720321,1536791610,2015-08-03 19:06:54 +0000,"<a href=""http://twitter.com/download/iphone"" rel=""nofollow"">Twitter for iPhone</a>","Levels of carbon dioxide in our atmosphere are higher than they’ve been in 800,000 years. 2014 was the planet’s warmest year on record.",,,,
628282174869999616,https://twitter.com/POTUS44/status/628282174869999616,628280902817304578,1536791610,2015-08-03 19:11:58 +0000,"<a href=""http://twitter.com/download/iphone"" rel=""nofollow"">Twitter for iPhone</a>","Right now, power plants account for about one-third of America’s carbon pollution. That’s more than our cars, airplanes, and homes combined.",,,,
628283044772868097,https://twitter.com/POTUS44/status/628283044772868097,628282174869999616,1536791610,2015-08-03 19:15:25 +0000,"<a href=""http://twitter.com/download/iphone"" rel=""nofollow"">Twitter for iPhone</a>","It's time to change that. With the Clean Power Plan, by 2030, carbon pollution from power plants will be 32% lower than it was a decade ago.",,,,
628283831104237569,https://twitter.com/POTUS44/status/628283831104237569,628283044772868097,1536791610,2015-08-03 19:18:32 +0000,"<a href=""http://twitter.com/download/iphone"" rel=""nofollow"">Twitter for iPhone</a>","Thanks to this plan, there will be 90,000 fewer asthma attacks among our kids and we'll avoid 3,600 premature deaths in 2030.",,,,
628285077970153472,https://twitter.com/POTUS44/status/628285077970153472,628283831104237569,1536791610,2015-08-03 19:23:30 +0000,"<a href=""http://twitter.com/download/iphone"" rel=""nofollow"">Twitter for iPhone</a>","Despite what the critics will tell you, this plan will ultimately save the average American family nearly $85 a year on their energy bills.",,,,
628286472781754368,https://twitter.com/POTUS44/status/628286472781754368,628285077970153472,1536791610,2015-08-03 19:29:02 +0000,"<a href=""http://twitter.com/download/iphone"" rel=""nofollow"">Twitter for iPhone</a>",I refuse to condemn our kids to a planet that's beyond fixing. Let's meet this challenge and #ActOnClimate together.,,,,
629028301454094336,https://twitter.com/POTUS44/status/629028301454094336,,,2015-08-05 20:36:48 +0000,"<a href=""http://twitter.com/download/iphone"" rel=""nofollow"">Twitter for iPhone</a>","It's the strongest nuclear deal ever negotiated. There's no such thing as a ""better deal."" Walking away risks war. https://t.co/la7GhQXfzl",,,,https://twitter.com/angelakkmiller/status/628944989406556160
629030461449338881,https://twitter.com/POTUS44/status/629030461449338881,,,2015-08-05 20:45:23 +0000,"<a href=""http://twitter.com/download/iphone"" rel=""nofollow"">Twitter for iPhone</a>",The choice is ultimately between diplomacy and war. Iran's nuclear program accelerates if Congress kills this deal. https://t.co/nvBeO1Omko,,,,https://twitter.com/senatemajldr/status/628946892236451840
629030795299147776,https://twitter.com/POTUS44/status/629030795299147776,,,2015-08-05 20:46:43 +0000,"<a href=""http://twitter.com/download/iphone"" rel=""nofollow"">Twitter for iPhone</a>",Important detail – there are no secret deals. My staff can brief you on any question about any part of the deal. https://t.co/UO0B5xCOPh,,,,https://twitter.com/stevescalise/status/628971521663475712
629064761188184064,https://twitter.com/POTUS44/status/629064761188184064,,,2015-08-05 23:01:41 +0000,"<a href=""http://twitter.com/download/iphone"" rel=""nofollow"">Twitter for iPhone</a>",Pretty incredible time lapse of the dark side of the moon passing Earth from @NASA. American ingenuity at work! http://t.co/JKep9bcxGQ,,,,https://twitter.com/POTUS/status/629064761188184064/video/1
629341526439653377,https://twitter.com/POTUS44/status/629341526439653377,,,2015-08-06 17:21:27 +0000,"<a href=""http://twitter.com/download/iphone"" rel=""nofollow"">Twitter for iPhone</a>","50 years ago today, President Johnson signed the Voting Rights Act into law, securing the right to vote for millions of African Americans.",,,,
629342056876503040,https://twitter.com/POTUS44/status/629342056876503040,629341526439653377,1536791610,2015-08-06 17:23:33 +0000,"<a href=""http://twitter.com/download/iphone"" rel=""nofollow"">Twitter for iPhone</a>","Before 1965, African Americans faced poll taxes, literacy tests, or having to count jellybeans in a jar when they tried to register to vote.",,,,
629342681962049538,https://twitter.com/POTUS44/status/629342681962049538,629342056876503040,1536791610,2015-08-06 17:26:02 +0000,"<a href=""http://twitter.com/download/iphone"" rel=""nofollow"">Twitter for iPhone</a>","Heroes like @RepJohnLewis, Dr. King, and countless others sacrificed so that all of our voices could be heard. http://t.co/L7kxtWQlYW",,,,https://twitter.com/POTUS/status/629342681962049538/photo/1
629343799299411969,https://twitter.com/POTUS44/status/629343799299411969,,,2015-08-06 17:30:29 +0000,"<a href=""http://twitter.com/download/iphone"" rel=""nofollow"">Twitter for iPhone</a>",Thank you for all you've done to protect our sacred right to vote. It's as important today as it's ever been. https://t.co/ge74wu5nc1,,,,https://twitter.com/repjohnlewis/status/629343428925636609
632209808930828288,https://twitter.com/POTUS44/status/632209808930828288,,,2015-08-14 15:18:58 +0000,"<a href=""http://twitter.com/download/iphone"" rel=""nofollow"">Twitter for iPhone</a>","RT @JohnKerry: Pleased to be in #Havana for historic day @USEmbCuba. Incredible: last time #SecState visited #Cuba, FDR was @POTUS. http://…",632205031740153856,15007149,2015-08-14 15:00:00 +0000,https://twitter.com/JohnKerry/status/632205031740153856/photo/1
632212730209009664,https://twitter.com/POTUS44/status/632212730209009664,,,2015-08-14 15:30:35 +0000,"<a href=""http://twitter.com/download/iphone"" rel=""nofollow"">Twitter for iPhone</a>","Due to popular request, here are my vacation playlists: http://t.co/uer5sIl4Vk http://t.co/zHEekHvQBr What's your favorite summer song?",,,,"http://spoti.fi/potusplaylist1,http://spoti.fi/potusplaylist2"
634413305516412928,https://twitter.com/POTUS44/status/634413305516412928,,,2015-08-20 17:14:53 +0000,"<a href=""http://twitter.com/download/iphone"" rel=""nofollow"">Twitter for iPhone</a>","President Carter is as good a man as they come. Michelle and I are praying for him and Rosalynn. We're all pulling for you, Jimmy.",,,,
636235501658222592,https://twitter.com/POTUS44/status/636235501658222592,,,2015-08-25 17:55:38 +0000,"<a href=""http://twitter.com"" rel=""nofollow"">Twitter Web Client</a>",The National Park Service: 99 years and 84 million acres strong. Congrats to all who work to protect these treasures. http://t.co/R8RyB9vkVW,,,,https://twitter.com/POTUS/status/636235501658222592/photo/1
636923084818259968,https://twitter.com/POTUS44/status/636923084818259968,,,2015-08-27 15:27:51 +0000,"<a href=""http://twitter.com/download/iphone"" rel=""nofollow"">Twitter for iPhone</a>","Amidst global volatility, Congress should protect the momentum of our growing economy (not kill it). We must avoid shutdown / austerity.",,,,
637733790090199040,https://twitter.com/POTUS44/status/637733790090199040,,,2015-08-29 21:09:18 +0000,"<a href=""http://twitter.com/download/iphone"" rel=""nofollow"">Twitter for iPhone</a>","In Treme, I was inspired by the progress &amp; people 10 years after Katrina. It gives us hope, but our work isn't done. http://t.co/LDqsARhnZt",,,,http://twitter.com/POTUS/status/637733790090199040/photo/1
638403631306248192,https://twitter.com/POTUS44/status/638403631306248192,,,2015-08-31 17:31:01 +0000,"<a href=""http://twitter.com"" rel=""nofollow"">Twitter Web Client</a>","Today we’re returning Mount McKinley to its native name - Denali, a step to reflect the heritage of Alaska Natives. http://t.co/WyzQImKymX",,,,https://twitter.com/POTUS/status/638403631306248192/photo/1
639508843773468672,https://twitter.com/POTUS44/status/639508843773468672,,,2015-09-03 18:42:44 +0000,"<a href=""http://twitter.com"" rel=""nofollow"">Twitter Web Client</a>",I loved Alaska and met so many inspiring people. Have to keep up the fight on climate change for their sake—and ours. http://t.co/HzWW0S6iQc,,,,http://snpy.tv/1JQQYbZ
640566616925818880,https://twitter.com/POTUS44/status/640566616925818880,,,2015-09-06 16:45:57 +0000,"<a href=""http://twitter.com/download/iphone"" rel=""nofollow"">Twitter for iPhone</a>","Thank you, Colin, for putting your experience and expertise behind this important initiative for our country. https://t.co/bSnaLMs8CU",,,,https://twitter.com/meetthepress/status/640515936647258112
642084092113256450,https://twitter.com/POTUS44/status/642084092113256450,,,2015-09-10 21:15:51 +0000,"<a href=""http://twitter.com/download/iphone"" rel=""nofollow"">Twitter for iPhone</a>",Today's Senate vote on the Iran deal is a historic step toward preventing Iran from obtaining a nuclear weapon. The world is safer for it.,,,,
642327755221299200,https://twitter.com/POTUS44/status/642327755221299200,,,2015-09-11 13:24:05 +0000,"<a href=""http://twitter.com/download/iphone"" rel=""nofollow"">Twitter for iPhone</a>","14 years after the terrorist attacks of 9/11, we honor those we lost. We salute all who serve to keep us safe. We stand as strong as ever.",,,,
643440607721992192,https://twitter.com/POTUS44/status/643440607721992192,,,2015-09-14 15:06:10 +0000,"<a href=""http://twitter.com"" rel=""nofollow"">Twitter Web Client</a>","""@FAFSA"" might be hard to say, but filling it out can help you pay for college. FLOTUS, you're up! #5TimesFAFSA http://t.co/y1Jv8aeGUH",,,,http://snpy.tv/1LtQ6v3
643882148315951104,https://twitter.com/POTUS44/status/643882148315951104,,,2015-09-15 20:20:41 +0000,"<a href=""http://twitter.com"" rel=""nofollow"">Twitter Web Client</a>","7 years ago today, Lehman Brothers filed for bankruptcy, setting off the worst financial crisis in decades. Here's how far we've come:",,,,
643882408283086848,https://twitter.com/POTUS44/status/643882408283086848,643882148315951104,1536791610,2015-09-15 20:21:43 +0000,"<a href=""http://twitter.com"" rel=""nofollow"">Twitter Web Client</a>","When I took office, 800,000 Americans lost their jobs each month. Our businesses have now added 13.1 million jobs over 66 straight months.",,,,
643883096689913856,https://twitter.com/POTUS44/status/643883096689913856,643882408283086848,1536791610,2015-09-15 20:24:27 +0000,"<a href=""http://twitter.com"" rel=""nofollow"">Twitter Web Client</a>",We've cut the unemployment rate in half – from a high of 10% down to 5.1%. And we're not done. http://t.co/uRfaSoiGuA,,,,http://twitter.com/POTUS/status/643883096689913856/photo/1
643883952093073408,https://twitter.com/POTUS44/status/643883952093073408,643883096689913856,1536791610,2015-09-15 20:27:51 +0000,"<a href=""http://twitter.com"" rel=""nofollow"">Twitter Web Client</a>","In 2009, our auto industry was flatlining. Now our workers are on pace to sell more American cars and trucks than any year since 2001.",,,,
643884680253599744,https://twitter.com/POTUS44/status/643884680253599744,643883952093073408,1536791610,2015-09-15 20:30:45 +0000,"<a href=""http://twitter.com"" rel=""nofollow"">Twitter Web Client</a>","When I took office, 15.4% of our population was uninsured. Today, we’ve cut that by more than a third. http://t.co/3OOqcz8Oxp",,,,https://twitter.com/POTUS/status/643884680253599744/photo/1
643885400847593472,https://twitter.com/POTUS44/status/643885400847593472,643884680253599744,1536791610,2015-09-15 20:33:37 +0000,"<a href=""http://twitter.com"" rel=""nofollow"">Twitter Web Client</a>","When I took office, the budget deficit had reached 9.2% of our GDP. We've cut that down to 2.8%. http://t.co/3viaw4b0bB",,,,https://twitter.com/POTUS/status/643885400847593472/photo/1
643886166769405952,https://twitter.com/POTUS44/status/643886166769405952,643885400847593472,1536791610,2015-09-15 20:36:39 +0000,"<a href=""http://twitter.com"" rel=""nofollow"">Twitter Web Client</a>",We've fought back because of you. We shouldn't slip back because of Congress. I urge them to send me a budget that invests in our future.,,,,
644193755814342656,https://twitter.com/POTUS44/status/644193755814342656,,,2015-09-16 16:58:54 +0000,"<a href=""http://twitter.com/download/iphone"" rel=""nofollow"">Twitter for iPhone</a>","Cool clock, Ahmed. Want to bring it to the White House? We should inspire more kids like you to like science. It's what makes America great.",,,,
646351288964354049,https://twitter.com/POTUS44/status/646351288964354049,,,2015-09-22 15:52:10 +0000,"<a href=""http://twitter.com/download/iphone"" rel=""nofollow"">Twitter for iPhone</a>",Our right to vote is sacred. It's the foundation of our democracy. You can find out how to register to vote at http://t.co/8kaqY0U3fn.,,,,http://vote.usa.gov
646390309551775744,https://twitter.com/POTUS44/status/646390309551775744,,,2015-09-22 18:27:13 +0000,"<a href=""http://twitter.com/download/iphone"" rel=""nofollow"">Twitter for iPhone</a>",Millions of families are more secure thanks to the ACA. Join them and #GetCovered on Nov 1: http://t.co/PJ7xIL6FjY  https://t.co/GF6yS0aHol,,,,"http://HealthCare.gov,https://twitter.com/secburwell/status/646328750372704256"
646666671864852480,https://twitter.com/POTUS44/status/646666671864852480,,,2015-09-23 12:45:23 +0000,"<a href=""http://twitter.com/download/iphone"" rel=""nofollow"">Twitter for iPhone</a>","Welcome to the White House, @Pontifex! Your messages of love, hope, and peace have inspired us all.",,,,
646786649251164160,https://twitter.com/POTUS44/status/646786649251164160,,,2015-09-23 20:42:08 +0000,"<a href=""http://twitter.com/download/iphone"" rel=""nofollow"">Twitter for iPhone</a>","Yogi Berra was an American original - a Hall of Famer, jovial prophet, &amp; a humble veteran. We'll miss you, Yogi, but your legacy ain't over.",,,,
647912497450606592,https://twitter.com/POTUS44/status/647912497450606592,,,2015-09-26 23:15:51 +0000,"<a href=""http://twitter.com/download/iphone"" rel=""nofollow"">Twitter for iPhone</a>",I'm grateful for the teachers who helped spark my sense of curiosity. The #62MillionGirls who aren't in school should have that same chance.,,,,
648542324167974917,https://twitter.com/POTUS44/status/648542324167974917,,,2015-09-28 16:58:34 +0000,"<a href=""http://twitter.com/download/iphone"" rel=""nofollow"">Twitter for iPhone</a>","Nearly 12 million people have been displaced by the conflict in Syria. As Americans, we can't sit idly by. That's not who we are.",,,,
648542721125294080,https://twitter.com/POTUS44/status/648542721125294080,648542324167974917,1536791610,2015-09-28 17:00:08 +0000,"<a href=""http://twitter.com/download/iphone"" rel=""nofollow"">Twitter for iPhone</a>",We've provided more than $4.5 billion in humanitarian aid to help meet the needs of those impacted by the Syrian conflict.,,,,
648543139196743680,https://twitter.com/POTUS44/status/648543139196743680,648542721125294080,1536791610,2015-09-28 17:01:48 +0000,"<a href=""http://twitter.com/download/iphone"" rel=""nofollow"">Twitter for iPhone</a>","We're also increasing the number of Syrian and other refugees we admit to the U.S. to 100,000 per year for the next two years.",,,,
648543480277544960,https://twitter.com/POTUS44/status/648543480277544960,648543139196743680,1536791610,2015-09-28 17:03:09 +0000,"<a href=""http://twitter.com/download/iphone"" rel=""nofollow"">Twitter for iPhone</a>",But this isn't just about what I can do as President. Every single one of us - from citizens to NGOs - can help refugees find safe haven.,,,,
648544017806938112,https://twitter.com/POTUS44/status/648544017806938112,648543480277544960,1536791610,2015-09-28 17:05:17 +0000,"<a href=""http://twitter.com/download/iphone"" rel=""nofollow"">Twitter for iPhone</a>",We have a moral responsibility to do what we can for families forced from their homes. Find out how you can help at http://t.co/J8A6mTD6D4.,,,,http://AidRefugees.gov
649748792099622912,https://twitter.com/POTUS44/status/649748792099622912,,,2015-10-02 00:52:38 +0000,"<a href=""http://twitter.com/download/iphone"" rel=""nofollow"">Twitter for iPhone</a>","Thanks, Zack. https://t.co/gOGzWmYdxQ",,,,https://twitter.com/zackbeauchamp/status/649727266835046400
654094154176315392,https://twitter.com/POTUS44/status/654094154176315392,,,2015-10-14 00:39:33 +0000,"<a href=""http://twitter.com/download/iphone"" rel=""nofollow"">Twitter for iPhone</a>",Congrats @Cubs - even @whitesox fans are rooting for you!,,,,
655044746759438336,https://twitter.com/POTUS44/status/655044746759438336,,,2015-10-16 15:36:52 +0000,"<a href=""http://twitter.com"" rel=""nofollow"">Twitter Web Client</a>",Congrats @HokuleaWWV on reaching Africa—midpoint of worldwide voyage to spread message of caring for the one planet we've got. #MalamaHonua,,,,
656153597932118018,https://twitter.com/POTUS44/status/656153597932118018,,,2015-10-19 17:03:03 +0000,"<a href=""http://twitter.com/download/iphone"" rel=""nofollow"">Twitter for iPhone</a>",I just met with CEOs of some of our biggest companies who are stepping up to #ActOnClimate. It's good for the planet - and the bottom line.,,,,
