tweet_id,tweet_link,in_reply_to_status_id,in_reply_to_user_id,timestamp,source,text,retweeted_status_id,retweeted_status_user_id,retweeted_status_timestamp,expanded_urls
700318872147066880,https://twitter.com/POTUS44/status/700318872147066880,,,2016-02-18 14:00:05 +0000,"<a href=""http://twitter.com/download/iphone"" rel=""nofollow"">Twitter for iPhone</a>","14 months ago, I announced that we would begin normalizing relations with Cuba - and we've already made significant progress.",,,,
700319236451741697,https://twitter.com/POTUS44/status/700319236451741697,700318872147066880,1536791610,2016-02-18 14:01:31 +0000,"<a href=""http://twitter.com/download/iphone"" rel=""nofollow"">Twitter for iPhone</a>",Our flag flies over our Embassy in Havana once again. More Americans are traveling to Cuba than at any time in the last 50 years.,,,,
700319754054074368,https://twitter.com/POTUS44/status/700319754054074368,700319236451741697,1536791610,2016-02-18 14:03:35 +0000,"<a href=""http://twitter.com/download/iphone"" rel=""nofollow"">Twitter for iPhone</a>",We still have differences with the Cuban government that I will raise directly. America will always stand for human rights around the world.,,,,
700320240022921216,https://twitter.com/POTUS44/status/700320240022921216,700319754054074368,1536791610,2016-02-18 14:05:31 +0000,"<a href=""http://twitter.com/download/iphone"" rel=""nofollow"">Twitter for iPhone</a>","Next month, I'll travel to Cuba to advance our progress and efforts that can improve the lives of the Cuban people.",,,,
700320856858189824,https://twitter.com/POTUS44/status/700320856858189824,700320240022921216,1536791610,2016-02-18 14:07:58 +0000,"<a href=""http://twitter.com/download/iphone"" rel=""nofollow"">Twitter for iPhone</a>",Here's how we're looking at the road ahead: https://t.co/a0KcsmpF39,,,,http://go.wh.gov/4b4M4z
701871557002407936,https://twitter.com/POTUS44/status/701871557002407936,,,2016-02-22 20:49:53 +0000,"<a href=""http://twitter.com/download/iphone"" rel=""nofollow"">Twitter for iPhone</a>",We've made big strides in the fight against Malaria - saving millions of lives. That's American leadership at work. https://t.co/jVdeE4Qktw,,,,http://twitter.com/POTUS/status/701871557002407936/photo/1
703359876483977217,https://twitter.com/POTUS44/status/703359876483977217,,,2016-02-26 23:23:57 +0000,"<a href=""http://twitter.com/download/iphone"" rel=""nofollow"">Twitter for iPhone</a>","Isiah, I'm so proud of you. Your kindness and willingness to help others is why I'm so hopeful for our future. https://t.co/RakSNxe7rk",,,,http://huff.to/21u24PG
704827179167846400,https://twitter.com/POTUS44/status/704827179167846400,,,2016-03-02 00:34:29 +0000,"<a href=""http://twitter.com/download/iphone"" rel=""nofollow"">Twitter for iPhone</a>",Play ball! https://t.co/S4DhVYa4Ef,,,,https://twitter.com/mlb/status/704825692890923008
705090664086773764,https://twitter.com/POTUS44/status/705090664086773764,,,2016-03-02 18:01:28 +0000,"<a href=""http://twitter.com/download/iphone"" rel=""nofollow"">Twitter for iPhone</a>","Welcome back to Earth, @StationCDRKelly! Your year in space is vital to the future of American space travel. Hope gravity isn't a drag!",,,,
707323697493704704,https://twitter.com/POTUS44/status/707323697493704704,,,2016-03-08 21:54:45 +0000,"<a href=""http://twitter.com"" rel=""nofollow"">Twitter Web Client</a>","Happy #InternationalWomensDay! When women are free to pursue their dreams, nations are more safe, more secure, and more prosperous.",,,,
708343852470435840,https://twitter.com/POTUS44/status/708343852470435840,,,2016-03-11 17:28:29 +0000,"<a href=""http://twitter.com"" rel=""nofollow"">Twitter Web Client</a>","At #SXSW, I'll make the case that tech and innovation can make government work better for everyone. Here's how it's working better already:",,,,
708344230729555970,https://twitter.com/POTUS44/status/708344230729555970,708343852470435840,1536791610,2016-03-11 17:29:59 +0000,"<a href=""http://twitter.com"" rel=""nofollow"">Twitter Web Client</a>",We've cut the time it takes students to apply for financial aid by two-thirds thanks to a simplified FAFSA form: https://t.co/WDD1UrSXIR,,,,http://fafsa.gov
708345011037798400,https://twitter.com/POTUS44/status/708345011037798400,708344230729555970,1536791610,2016-03-11 17:33:05 +0000,"<a href=""http://twitter.com"" rel=""nofollow"">Twitter Web Client</a>","Immigrants can now apply online to renew their green cards faster, and prep for the citizenship civics test online.",,,,
708346091578593280,https://twitter.com/POTUS44/status/708346091578593280,708345011037798400,1536791610,2016-03-11 17:37:23 +0000,"<a href=""http://twitter.com"" rel=""nofollow"">Twitter Web Client</a>",Nearly 1 in 3 American families struggle to afford diapers. We're working with the private sector to help fix this. https://t.co/fxvdOCFeET,,,,http://twitter.com/POTUS/status/708346091578593280/photo/1
708346933933416449,https://twitter.com/POTUS44/status/708346933933416449,708346091578593280,1536791610,2016-03-11 17:40:44 +0000,"<a href=""http://twitter.com"" rel=""nofollow"">Twitter Web Client</a>",Seniors can now apply for Social Security benefits online: https://t.co/jPEHLkNxfk,,,,http://1.usa.gov/1RTe2O8
708348813858054145,https://twitter.com/POTUS44/status/708348813858054145,708346933933416449,1536791610,2016-03-11 17:48:12 +0000,"<a href=""http://twitter.com"" rel=""nofollow"">Twitter Web Client</a>","Looking forward to discussing more ways we can modernize government so it's as smart and dynamic as America itself. See you soon, Austin.",,,,
710141204755783681,https://twitter.com/POTUS44/status/710141204755783681,,,2016-03-16 16:30:31 +0000,"<a href=""http://twitter.com/download/iphone"" rel=""nofollow"">Twitter for iPhone</a>",Proud to nominate Judge Merrick Garland to the Supreme Court. I ask Senators to meet their constitutional duty and give him a fair hearing.,,,,
710141347051786244,https://twitter.com/POTUS44/status/710141347051786244,,,2016-03-16 16:31:05 +0000,"<a href=""http://twitter.com/download/iphone"" rel=""nofollow"">Twitter for iPhone</a>","RT @SCOTUSnom: Meet Chief Judge Merrick Garland, the President's nominee to the Supreme Court. #SCOTUSnominee https://t.co/ACujysyyDJ",710127524014104576,708072909114318848,2016-03-16 15:36:09 +0000,"http://go.wh.gov/MerrickGarland,http://go.wh.gov/MerrickGarland"
710599731827834880,https://twitter.com/POTUS44/status/710599731827834880,,,2016-03-17 22:52:33 +0000,"<a href=""http://twitter.com"" rel=""nofollow"">Twitter Web Client</a>",A great example of how tech can make our democracy stronger. Thanks for answering the call to serve. https://t.co/dFU57cuxo8,,,,https://twitter.com/WorkSteven/status/710302819278925824
711649199243177984,https://twitter.com/POTUS44/status/711649199243177984,,,2016-03-20 20:22:45 +0000,"<a href=""http://twitter.com"" rel=""nofollow"">Twitter Web Client</a>","¿Que bolá Cuba? Just touched down here, looking forward to meeting and hearing directly from the Cuban people.",,,,
714084384010272768,https://twitter.com/POTUS44/status/714084384010272768,,,2016-03-27 13:39:18 +0000,"<a href=""http://twitter.com/download/iphone"" rel=""nofollow"">Twitter for iPhone</a>","From my family to yours, Happy Easter, and we wish everyone celebrating a blessed and joyful day. https://t.co/fNvcihSmYB",,,,http://twitter.com/POTUS/status/714084384010272768/photo/1
714870949594603520,https://twitter.com/POTUS44/status/714870949594603520,,,2016-03-29 17:44:50 +0000,"<a href=""http://twitter.com/download/iphone"" rel=""nofollow"">Twitter for iPhone</a>",RT @RepHalRogers: Honored to have our Commander-in-Chief @POTUS @RxSummit to lead this critical discussion about the nation's drug abuse ep…,714844724050309121,550401754,2016-03-29 16:00:38 +0000,
714871062865903616,https://twitter.com/POTUS44/status/714871062865903616,714844724050309121,550401754,2016-03-29 17:45:17 +0000,"<a href=""http://twitter.com/download/iphone"" rel=""nofollow"">Twitter for iPhone</a>","Thank you for your leadership @RepHalRogers. This epidemic doesn't discriminate between red or blue, so it's up to all of us to do our part.",,,,
717026378739290112,https://twitter.com/POTUS44/status/717026378739290112,,,2016-04-04 16:29:45 +0000,"<a href=""http://twitter.com/download/iphone"" rel=""nofollow"">Twitter for iPhone</a>",Nobody should have to choose between losing a paycheck &amp; caring for their family. I applaud @NYGovCuomo for taking a big step on paid leave.,,,,
717131662170173440,https://twitter.com/POTUS44/status/717131662170173440,,,2016-04-04 23:28:06 +0000,"<a href=""http://twitter.com/download/iphone"" rel=""nofollow"">Twitter for iPhone</a>","RT @repjohnlewis: 48 yrs ago today, my friend, my brother, Dr. Martin Luther King, Jr. was shot and killed in Memphis, TN. The light of his…",717004180829954048,29450962,2016-04-04 15:01:32 +0000,
718579793919238144,https://twitter.com/POTUS44/status/718579793919238144,,,2016-04-08 23:22:28 +0000,"<a href=""http://twitter.com/download/iphone"" rel=""nofollow"">Twitter for iPhone</a>",Congrats SpaceX on landing a rocket at sea. It's because of innovators like you &amp; NASA that America continues to lead in space exploration.,,,,
719899559988740096,https://twitter.com/POTUS44/status/719899559988740096,,,2016-04-12 14:46:44 +0000,"<a href=""http://twitter.com/download/iphone"" rel=""nofollow"">Twitter for iPhone</a>",Proud to designate the Belmont-Paul national monument for women's equality. Let's keep up their fight with #EqualPay for women today.,,,,
720416675196223488,https://twitter.com/POTUS44/status/720416675196223488,,,2016-04-14 01:01:34 +0000,"<a href=""http://twitter.com/download/iphone"" rel=""nofollow"">Twitter for iPhone</a>","Big night of basketball - @Warriors chasing 73 and a farewell for an
all-timer, @KobeBryant. NBA fans feeling like: https://t.co/hvno2ZO5b0",,,,http://twitter.com/POTUS/status/720416675196223488/photo/1
720476914243280896,https://twitter.com/POTUS44/status/720476914243280896,,,2016-04-14 05:00:56 +0000,"<a href=""http://twitter.com/download/iphone"" rel=""nofollow"">Twitter for iPhone</a>","Congrats to the @Warriors, a great group of guys on and off the court. If somebody had to break the Bulls' record, I'm glad it's them.",,,,
722217866330636288,https://twitter.com/POTUS44/status/722217866330636288,,,2016-04-19 00:18:52 +0000,"<a href=""http://twitter.com/download/iphone"" rel=""nofollow"">Twitter for iPhone</a>","Thank you, Adrianne, for being Boston Strong. Terror and bombs can't beat us. We carry on. We finish the race! https://t.co/55hmcsCHbJ",,,,http://cbsloc.al/1S6LCSs
723568187447500800,https://twitter.com/POTUS44/status/723568187447500800,,,2016-04-22 17:44:33 +0000,"<a href=""http://twitter.com/download/iphone"" rel=""nofollow"">Twitter for iPhone</a>","Today, the US joined some 170 nations to sign the Paris Agreement - an historic step this Earth Day to protect the one planet we've got.",,,,
727561463993270272,https://twitter.com/POTUS44/status/727561463993270272,,,2016-05-03 18:12:25 +0000,"<a href=""http://twitter.com/download/iphone"" rel=""nofollow"">Twitter for iPhone</a>",To my 5th grade teacher Ms. Mabel Hefty and the educators who inspire our young people every single day: Thank you. https://t.co/fz2ij8daBg,,,,https://twitter.com/PunahouSchool/status/593489304770498561/photo/1
732266263528001537,https://twitter.com/POTUS44/status/732266263528001537,,,2016-05-16 17:47:36 +0000,"<a href=""http://twitter.com/download/iphone"" rel=""nofollow"">Twitter for iPhone</a>","Today, I join all Americans in honoring 13 officers who went beyond the call of duty to save the lives of strangers. https://t.co/OufzQ70ovH",,,,http://twitter.com/POTUS/status/732266263528001537/photo/1
737267478661730304,https://twitter.com/POTUS44/status/737267478661730304,,,2016-05-30 13:00:39 +0000,"<a href=""http://twitter.com"" rel=""nofollow"">Twitter Web Client</a>","This Memorial Day, I hope you'll join me in acts of remembrance. The debt we owe our fallen heroes is one we can never truly repay.",,,,
738388734207512578,https://twitter.com/POTUS44/status/738388734207512578,,,2016-06-02 15:16:07 +0000,"<a href=""http://twitter.com/download/iphone"" rel=""nofollow"">Twitter for iPhone</a>",We cannot accept our level of gun violence as the new normal. We must take action to prevent this from happening again &amp; again. #WearOrange,,,,
739095745584844800,https://twitter.com/POTUS44/status/739095745584844800,,,2016-06-04 14:05:32 +0000,"<a href=""http://twitter.com/download/iphone"" rel=""nofollow"">Twitter for iPhone</a>","He shook up the world, and the world's better for it. Rest in peace, Champ. https://t.co/z1yM3sSLH3",,,,http://twitter.com/POTUS/status/739095745584844800/photo/1
739817582514016256,https://twitter.com/POTUS44/status/739817582514016256,,,2016-06-06 13:53:51 +0000,"<a href=""http://twitter.com"" rel=""nofollow"">Twitter Web Client</a>","RT @FLOTUS: Together, we are stronger. Together we can change tomorrow. Stand with us: https://t.co/kMuWTuXTdb #StateOfWomen
https://t.co/m…",739790326454312960,1093090866,2016-06-06 12:05:33 +0000,"http://www.theunitedstateofwomen.org,http://www.theunitedstateofwomen.org,https://amp.twimg.com/v/144d35e7-9e4c-4f5e-a0f6-6e352e434d17"
744656711596773380,https://twitter.com/POTUS44/status/744656711596773380,,,2016-06-19 22:22:49 +0000,"<a href=""http://twitter.com/download/iphone"" rel=""nofollow"">Twitter for iPhone</a>",Happy Father's Day to all the dads out there. Glad to be spending this one with my family in Yosemite. https://t.co/SaNJgmoIK1,,,,https://twitter.com/flotus/status/744547424757223425
744734234179477504,https://twitter.com/POTUS44/status/744734234179477504,,,2016-06-20 03:30:52 +0000,"<a href=""http://twitter.com/download/iphone"" rel=""nofollow"">Twitter for iPhone</a>",What a game and what a series for the @Cavs. Happy to see @KingJames bring it home for Cleveland!,,,,
745272915780743168,https://twitter.com/POTUS44/status/745272915780743168,,,2016-06-21 15:11:24 +0000,"<a href=""http://twitter.com/download/iphone"" rel=""nofollow"">Twitter for iPhone</a>","Gun violence requires more than moments of silence. It requires action. In failing that test, the Senate failed the American people.",,,,
745327295544569856,https://twitter.com/POTUS44/status/745327295544569856,,,2016-06-21 18:47:29 +0000,"<a href=""http://twitter.com/download/iphone"" rel=""nofollow"">Twitter for iPhone</a>","By giving him its highest rating, the American Bar Association confirms what we all know: Judge Garland should serve on the Supreme Court.",,,,
745674203286773761,https://twitter.com/POTUS44/status/745674203286773761,,,2016-06-22 17:45:58 +0000,"<a href=""http://twitter.com"" rel=""nofollow"">Twitter Web Client</a>",Thank you John Lewis for leading on gun violence where we need it most. https://t.co/vctfqAH5Wt,,,,https://twitter.com/repjohnlewis/status/745631702186336256
747466445345349632,https://twitter.com/POTUS44/status/747466445345349632,,,2016-06-27 16:27:42 +0000,"<a href=""http://twitter.com"" rel=""nofollow"">Twitter Web Client</a>",Every woman has a constitutional right to make her own reproductive choices. I'm pleased to see the Supreme Court reaffirm that fact today.,,,,
747466642725056512,https://twitter.com/POTUS44/status/747466642725056512,747466445345349632,1536791610,2016-06-27 16:28:29 +0000,"<a href=""http://twitter.com"" rel=""nofollow"">Twitter Web Client</a>","Women’s opportunities are expanded and our nation is stronger when all of our citizens have accessible, affordable health care.",,,,
748541124524929024,https://twitter.com/POTUS44/status/748541124524929024,,,2016-06-30 15:38:05 +0000,"<a href=""http://twitter.com"" rel=""nofollow"">Twitter Web Client</a>","Until next time, Justin. Good to know that Canada and the world will benefit from your leadership for years to come. https://t.co/T10g64niul",,,,https://twitter.com/JustinTrudeau/status/748313331673501696
748620388175798272,https://twitter.com/POTUS44/status/748620388175798272,,,2016-06-30 20:53:03 +0000,"<a href=""http://twitter.com"" rel=""nofollow"">Twitter Web Client</a>",Proud to sign laws to improve transparency and avert a crisis in Puerto Rico. I'd hoped to use my pen more often before Congress left town.,,,,
748620582216884224,https://twitter.com/POTUS44/status/748620582216884224,748620388175798272,1536791610,2016-06-30 20:53:50 +0000,"<a href=""http://twitter.com"" rel=""nofollow"">Twitter Web Client</a>",Congress is leaving a hefty to-do list undone. Health officials still need emergency funding to effectively protect Americans from Zika.,,,,
748620897309757440,https://twitter.com/POTUS44/status/748620897309757440,748620582216884224,1536791610,2016-06-30 20:55:05 +0000,"<a href=""http://twitter.com"" rel=""nofollow"">Twitter Web Client</a>","After more than 100 days, the Supreme Court still needs its 9th judge, but the Senate GOP refuses to do its job and consider Judge Garland.",,,,
748621170015076352,https://twitter.com/POTUS44/status/748621170015076352,748620897309757440,1536791610,2016-06-30 20:56:10 +0000,"<a href=""http://twitter.com"" rel=""nofollow"">Twitter Web Client</a>",Americans still need and are asking Congress to pass commonsense gun laws that strengthen background checks and keep our communities safe.,,,,
748621673578958849,https://twitter.com/POTUS44/status/748621673578958849,748621170015076352,1536791610,2016-06-30 20:58:10 +0000,"<a href=""http://twitter.com"" rel=""nofollow"">Twitter Web Client</a>","The list goes on. When Members return, I hope they'll share my commitment to work together to do what must be done. https://t.co/l8nChcXpml",,,,https://twitter.com/POTUS/status/748621673578958849/photo/1
748666260599218177,https://twitter.com/POTUS44/status/748666260599218177,,,2016-06-30 23:55:20 +0000,"<a href=""http://twitter.com/download/iphone"" rel=""nofollow"">Twitter for iPhone</a>",RT @MarchofDimes: 2016 Nat'l Amb. Ismael was honored to meet @POTUS today &amp; talk about the need to help babies &amp; #ZAPzika! https://t.co/Zzw…,748657015141072896,8539242,2016-06-30 23:18:36 +0000,http://twitter.com/MarchofDimes/status/748657015141072896/photo/1
749378629822545920,https://twitter.com/POTUS44/status/749378629822545920,,,2016-07-02 23:06:02 +0000,"<a href=""http://twitter.com/download/iphone"" rel=""nofollow"">Twitter for iPhone</a>",Elie Wiesel was a great moral voice of our time and a conscience for our world. He was also a dear friend. We will miss him deeply.,,,,
749966042135293952,https://twitter.com/POTUS44/status/749966042135293952,,,2016-07-04 14:00:12 +0000,"<a href=""http://twitter.com/download/iphone"" rel=""nofollow"">Twitter for iPhone</a>","Happy Fourth of July, everybody! And to our brave men and women in uniform: On this day and every day, we thank you.",,,,
750379001546416128,https://twitter.com/POTUS44/status/750379001546416128,,,2016-07-05 17:21:09 +0000,"<a href=""http://twitter.com/download/iphone"" rel=""nofollow"">Twitter for iPhone</a>","Incredible! After a 5-year journey, we're up close and personal with our solar system's largest planet. Welcome to Jupiter, @NASAJuno!",,,,
753403382744780800,https://twitter.com/POTUS44/status/753403382744780800,,,2016-07-14 01:38:58 +0000,"<a href=""http://twitter.com"" rel=""nofollow"">Twitter Web Client</a>","Congrats Carla Hayden, our newest Librarian of Congress! Her confirmation is certainly one for the history books.
https://t.co/5T8rvSRp9e",,,,https://amp.twimg.com/v/146bf05b-4ac0-49e4-8eab-322885e67fe5
755043199731675137,https://twitter.com/POTUS44/status/755043199731675137,,,2016-07-18 14:15:01 +0000,"<a href=""http://twitter.com"" rel=""nofollow"">Twitter Web Client</a>",44 men came home because Chuck Kettles believed that we leave no man behind. That's America at our best. https://t.co/UymO2AaRHg,,,,https://amp.twimg.com/v/2cf646b9-e282-483c-87c3-7cdb02ca6895
755803507760902144,https://twitter.com/POTUS44/status/755803507760902144,,,2016-07-20 16:36:13 +0000,"<a href=""http://twitter.com"" rel=""nofollow"">Twitter Web Client</a>","This map says it all. Stay safe as it heats up: Drink water, stay out of the sun, and check on your neighbors. https://t.co/c1qFTmq2IV",,,,http://twitter.com/POTUS/status/755803507760902144/photo/1
756568912691601410,https://twitter.com/POTUS44/status/756568912691601410,,,2016-07-22 19:17:39 +0000,"<a href=""http://twitter.com"" rel=""nofollow"">Twitter Web Client</a>","¡Bienvenido, amigo! We value our enduring partnership with Mexico &amp; will work to strengthen it in the years to come. https://t.co/mjlABSm7jF",,,,https://twitter.com/EPN/status/756289302418497536
757763701101490176,https://twitter.com/POTUS44/status/757763701101490176,,,2016-07-26 02:25:19 +0000,"<a href=""http://twitter.com/download/iphone"" rel=""nofollow"">Twitter for iPhone</a>","Incredible speech by an incredible woman. Couldn't be more proud &amp; our country has been blessed to have her as FLOTUS. I love you, Michelle.",,,,
758867227328163841,https://twitter.com/POTUS44/status/758867227328163841,,,2016-07-29 03:30:20 +0000,"<a href=""http://twitter.com/download/iphone"" rel=""nofollow"">Twitter for iPhone</a>","Great speech. She's tested. She's ready. She never quits. That's why Hillary should be our next @POTUS. (She'll get the Twitter handle, too)",,,,
761640808009302016,https://twitter.com/POTUS44/status/761640808009302016,,,2016-08-05 19:11:33 +0000,"<a href=""http://twitter.com"" rel=""nofollow"">Twitter Web Client</a>","Longest streak of total job growth on record, wages rising at fastest pace in 7 years. We've come a long way, America—let's keep it going.",,,,
761703659411345408,https://twitter.com/POTUS44/status/761703659411345408,,,2016-08-05 23:21:18 +0000,"<a href=""http://twitter.com/download/iphone"" rel=""nofollow"">Twitter for iPhone</a>",Ready to root on #TeamUSA! Our team's unity and diversity makes us so proud - and reminds the world why America sets the gold standard.,,,,
761703867402686464,https://twitter.com/POTUS44/status/761703867402686464,761703659411345408,1536791610,2016-08-05 23:22:08 +0000,"<a href=""http://twitter.com/download/iphone"" rel=""nofollow"">Twitter for iPhone</a>","Tonight, the first-ever #TeamRefugees will also stand before the world and prove that you can succeed no matter where you're from.",,,,
762030430954684416,https://twitter.com/POTUS44/status/762030430954684416,,,2016-08-06 20:59:47 +0000,"<a href=""http://twitter.com/download/iphone"" rel=""nofollow"">Twitter for iPhone</a>",The struggle for the Voting Rights Act taught us that people who love this country can change it. Don't give away your power - go vote.,,,,
763744742072913920,https://twitter.com/POTUS44/status/763744742072913920,,,2016-08-11 14:31:50 +0000,"<a href=""http://twitter.com"" rel=""nofollow"">Twitter Web Client</a>","Been waiting to drop this: summer playlist, the encore. What's everybody listening to? https://t.co/mqh1YVrycj",,,,"http://twitter.com/POTUS/status/763744742072913920/photo/1,http://twitter.com/POTUS/status/763744742072913920/photo/1"
764961309767131136,https://twitter.com/POTUS44/status/764961309767131136,,,2016-08-14 23:06:03 +0000,"<a href=""http://twitter.com/download/iphone"" rel=""nofollow"">Twitter for iPhone</a>",Final win for Phelps. World record for Ledecky. 3 #1 finishes for Biles. That's how #TeamUSA gets America to 1000 golds-way to make history.,,,,
767528566099701760,https://twitter.com/POTUS44/status/767528566099701760,,,2016-08-22 01:07:24 +0000,"<a href=""http://twitter.com/download/iphone"" rel=""nofollow"">Twitter for iPhone</a>","Couldn't be prouder of #TeamUSA. Your determination and passion inspired so many of us. You carried that flag high tonight, @Simone_Biles!",,,,
768833523729903618,https://twitter.com/POTUS44/status/768833523729903618,,,2016-08-25 15:32:50 +0000,"<a href=""http://twitter.com"" rel=""nofollow"">Twitter Web Client</a>","Felicitaciones, @JuanManSantos and Colombia. After decades of war, we stand with you in building a future of peace. https://t.co/haXJaqgS9f",,,,https://twitter.com/JuanManSantos/status/768614115019489281
768871824885026817,https://twitter.com/POTUS44/status/768871824885026817,,,2016-08-25 18:05:02 +0000,"<a href=""https://about.twitter.com/products/tweetdeck"" rel=""nofollow"">TweetDeck</a>","100 years and going strong. Thanks @NatlParkService for your service, so our kids enjoy our parks as much as we have https://t.co/1v3W2HLD6f",,,,http://twitter.com/POTUS/status/768871824885026817/photo/1
769204867235667969,https://twitter.com/POTUS44/status/769204867235667969,,,2016-08-26 16:08:26 +0000,"<a href=""http://twitter.com"" rel=""nofollow"">Twitter Web Client</a>","Nearly 100 years ago, women broke down barriers to the ballot box, moving us closer to a more equal nation. Let's finish what they started.",,,,
770050438578184192,https://twitter.com/POTUS44/status/770050438578184192,,,2016-08-29 00:08:26 +0000,"<a href=""http://twitter.com/download/iphone"" rel=""nofollow"">Twitter for iPhone</a>","Congratulations to Maine-Endwell, Little League World Series Champs and still undefeated! Proud of you and the sportsmanship you showed.",,,,
770297035274584068,https://twitter.com/POTUS44/status/770297035274584068,,,2016-08-29 16:28:19 +0000,"<a href=""http://twitter.com"" rel=""nofollow"">Twitter Web Client</a>",Congrats to NASA and the scientists taking us a step closer to Mars. Now enjoy Hawaii and get a shave ice! https://t.co/lFZjSnn38x,,,,http://usat.ly/2c79F6j
772841067276333056,https://twitter.com/POTUS44/status/772841067276333056,,,2016-09-05 16:57:23 +0000,"<a href=""http://twitter.com/#!/download/ipad"" rel=""nofollow"">Twitter for iPad</a>","Happy Labor Day - longest streak of job growth ever, unemployment cut in half. That's what hardworking Americans can do. Let's keep going!",,,,
